{
  "asset_id": "notice_board_01_20260742",
  "kind": "tile_object",
  "tags": [
    "notice_board_01",
    "text_sign",
    "notice_board"
  ],
  "tile_size": [
    32,
    32
  ],
  "theme": [
    "school_campus"
  ],
  "footprint": [
    2,
    1
  ],
  "anchor": "center",
  "sprite_path": "notice_board_01_20260742.png",
  "metadata_path": "notice_board_01_20260742.json",
  "generated": {
    "timestamp": "2026-06-09T20:07:37.717078",
    "generator": "MockGenerator-v1",
    "prompt": "1998 年县城小学教学楼门口的旧木质通知栏，褪色红色木框，几张泛黄空白纸贴在板面上，没有任何可读文字，适合 RPG 地图正面贴附物件。\nThe generated PNG must show only a blank signboard or blank papers.\nDo not render readable text, Chinese characters, Latin letters, handwriting, slogans, or labels.\nStrictly avoid: readable text, Chinese characters, letters, watermark, background, photorealistic, readable text, Chinese characters, letters, handwriting",
    "seed": 20260742,
    "model": "mock"
  },
  "source": {
    "type": "generated",
    "attribution": "AI-generated by asset_general_system"
  }
}