{
  "asset_id": "barrel_5010",
  "kind": "tile_object",
  "tags": [
    "barrel",
    "container",
    "blocking"
  ],
  "tile_size": [
    32,
    32
  ],
  "theme": [
    "village",
    "dungeon",
    "ship"
  ],
  "footprint": [
    1,
    1
  ],
  "collision": [
    [
      0,
      0
    ]
  ],
  "anchor": "center",
  "sprite_path": "barrel_5010.png",
  "metadata_path": "barrel_5010.json",
  "generated": {
    "timestamp": "2026-06-06T16:31:11.621997",
    "generator": "MockGenerator-v1",
    "prompt": "wooden barrel with metal bands",
    "seed": 5010,
    "model": "mock"
  },
  "source": {
    "type": "generated",
    "attribution": "AI-generated by asset_general_system"
  }
}