{
  "asset_id": "signpost_5017",
  "kind": "tile_object",
  "tags": [
    "signpost",
    "marker",
    "decoration",
    "blocking"
  ],
  "tile_size": [
    32,
    32
  ],
  "theme": [
    "village",
    "forest",
    "crossroad"
  ],
  "footprint": [
    1,
    1
  ],
  "collision": [
    [
      0,
      0
    ]
  ],
  "anchor": "center",
  "sprite_path": "signpost_5017.png",
  "metadata_path": "signpost_5017.json",
  "generated": {
    "timestamp": "2026-06-06T16:31:11.637875",
    "generator": "MockGenerator-v1",
    "prompt": "wooden signpost with directional arrows",
    "seed": 5017,
    "model": "mock"
  },
  "source": {
    "type": "generated",
    "attribution": "AI-generated by asset_general_system"
  }
}