{
  "asset_id": "barrel_5717",
  "kind": "tile_object",
  "tags": [
    "barrel"
  ],
  "tile_size": [
    32,
    32
  ],
  "footprint": [
    1,
    1
  ],
  "anchor": "center",
  "sprite_path": "barrel_5717.png",
  "metadata_path": "barrel_5717.json",
  "generated": {
    "timestamp": "2026-06-06T18:59:05.935577",
    "generator": "MockGenerator-v1",
    "prompt": "破旧的木桶",
    "seed": 5717,
    "model": "mock"
  },
  "source": {
    "type": "generated",
    "attribution": "AI-generated by asset_general_system"
  }
}