{
  "asset_id": "gate_5020",
  "kind": "tile_object",
  "tags": [
    "gate",
    "door",
    "entrance"
  ],
  "tile_size": [
    32,
    32
  ],
  "theme": [
    "village",
    "castle",
    "garden"
  ],
  "footprint": [
    2,
    1
  ],
  "anchor": "center",
  "sprite_path": "gate_5020.png",
  "metadata_path": "gate_5020.json",
  "generated": {
    "timestamp": "2026-06-06T16:31:11.651967",
    "generator": "MockGenerator-v1",
    "prompt": "wooden gate with iron reinforcement",
    "seed": 5020,
    "model": "mock"
  },
  "source": {
    "type": "generated",
    "attribution": "AI-generated by asset_general_system"
  }
}