{
  "asset_id": "well_5014",
  "kind": "tile_object",
  "tags": [
    "well",
    "water",
    "building",
    "blocking"
  ],
  "tile_size": [
    32,
    32
  ],
  "theme": [
    "village",
    "desert",
    "ruins"
  ],
  "footprint": [
    2,
    2
  ],
  "collision": [
    [
      0,
      1
    ],
    [
      1,
      1
    ]
  ],
  "anchor": "bottom_center",
  "sprite_path": "well_5014.png",
  "metadata_path": "well_5014.json",
  "generated": {
    "timestamp": "2026-06-06T16:31:11.631955",
    "generator": "MockGenerator-v1",
    "prompt": "stone well with wooden roof",
    "seed": 5014,
    "model": "mock"
  },
  "source": {
    "type": "generated",
    "attribution": "AI-generated by asset_general_system"
  }
}