{
  "asset_id": "tree_dead_5005",
  "kind": "tile_object",
  "tags": [
    "tree_dead",
    "tree",
    "dead",
    "nature",
    "blocking"
  ],
  "tile_size": [
    32,
    32
  ],
  "theme": [
    "ruins",
    "desert",
    "haunted"
  ],
  "footprint": [
    1,
    2
  ],
  "collision": [
    [
      0,
      1
    ]
  ],
  "anchor": "bottom_center",
  "sprite_path": "tree_dead_5005.png",
  "metadata_path": "tree_dead_5005.json",
  "generated": {
    "timestamp": "2026-06-06T16:31:11.610946",
    "generator": "MockGenerator-v1",
    "prompt": "dead tree with bare branches",
    "seed": 5005,
    "model": "mock"
  },
  "source": {
    "type": "generated",
    "attribution": "AI-generated by asset_general_system"
  }
}