{
  "asset_id": "gold_chest_4138",
  "kind": "tile_object",
  "tags": [
    "gold_chest",
    "chest",
    "ancient",
    "gold",
    "blocking"
  ],
  "tile_size": [
    32,
    32
  ],
  "footprint": [
    1,
    1
  ],
  "collision": [
    [
      0,
      0
    ]
  ],
  "anchor": "center",
  "sprite_path": "gold_chest_4138.png",
  "metadata_path": "gold_chest_4138.json",
  "generated": {
    "timestamp": "2026-06-06T19:11:01.622861",
    "generator": "gemini/gemini-3.1-flash-image-preview",
    "prompt": "古老的金色宝箱",
    "seed": 4138,
    "model": "gemini-3.1-flash-image-preview"
  },
  "source": {
    "type": "generated",
    "attribution": "AI-generated by asset_general_system"
  }
}