{
  "asset_id": "torch_5018",
  "kind": "tile_object",
  "tags": [
    "torch",
    "light",
    "fire",
    "decoration"
  ],
  "tile_size": [
    32,
    32
  ],
  "theme": [
    "dungeon",
    "castle",
    "cave"
  ],
  "footprint": [
    1,
    1
  ],
  "anchor": "center",
  "sprite_path": "torch_5018.png",
  "metadata_path": "torch_5018.json",
  "generated": {
    "timestamp": "2026-06-06T16:31:11.643272",
    "generator": "MockGenerator-v1",
    "prompt": "wall-mounted torch with flame",
    "seed": 5018,
    "model": "mock"
  },
  "source": {
    "type": "generated",
    "attribution": "AI-generated by asset_general_system"
  }
}