{
  "asset_id": "tree_pine_5002",
  "kind": "tile_object",
  "tags": [
    "tree_pine",
    "tree",
    "pine",
    "nature",
    "blocking"
  ],
  "tile_size": [
    32,
    32
  ],
  "theme": [
    "forest",
    "snow",
    "mountains"
  ],
  "footprint": [
    1,
    2
  ],
  "collision": [
    [
      0,
      1
    ]
  ],
  "anchor": "bottom_center",
  "sprite_path": "tree_pine_5002.png",
  "metadata_path": "tree_pine_5002.json",
  "generated": {
    "timestamp": "2026-06-06T16:31:11.602839",
    "generator": "MockGenerator-v1",
    "prompt": "pine tree with dark green needles and conical shape",
    "seed": 5002,
    "model": "mock"
  },
  "source": {
    "type": "generated",
    "attribution": "AI-generated by asset_general_system"
  }
}