{
  "asset_id": "tree_oak_5001",
  "kind": "tile_object",
  "tags": [
    "tree_oak",
    "tree",
    "oak",
    "nature",
    "blocking"
  ],
  "tile_size": [
    32,
    32
  ],
  "theme": [
    "forest",
    "village",
    "plains"
  ],
  "footprint": [
    1,
    2
  ],
  "collision": [
    [
      0,
      1
    ]
  ],
  "anchor": "bottom_center",
  "sprite_path": "tree_oak_5001.png",
  "metadata_path": "tree_oak_5001.json",
  "generated": {
    "timestamp": "2026-06-06T16:31:11.600738",
    "generator": "MockGenerator-v1",
    "prompt": "oak tree with green leaves and brown trunk",
    "seed": 5001,
    "model": "mock"
  },
  "source": {
    "type": "generated",
    "attribution": "AI-generated by asset_general_system"
  }
}