{
  "asset_id": "crate_5011",
  "kind": "tile_object",
  "tags": [
    "crate",
    "container",
    "blocking"
  ],
  "tile_size": [
    32,
    32
  ],
  "theme": [
    "village",
    "warehouse",
    "dock"
  ],
  "footprint": [
    1,
    1
  ],
  "collision": [
    [
      0,
      0
    ]
  ],
  "anchor": "center",
  "sprite_path": "crate_5011.png",
  "metadata_path": "crate_5011.json",
  "generated": {
    "timestamp": "2026-06-06T16:31:11.623983",
    "generator": "MockGenerator-v1",
    "prompt": "wooden crate with nails",
    "seed": 5011,
    "model": "mock"
  },
  "source": {
    "type": "generated",
    "attribution": "AI-generated by asset_general_system"
  }
}