{
  "asset_id": "mystic_teleport_1547",
  "kind": "tile_object",
  "tags": [
    "mystic_teleport",
    "mystic"
  ],
  "tile_size": [
    32,
    32
  ],
  "footprint": [
    1,
    1
  ],
  "anchor": "center",
  "sprite_path": "mystic_teleport_1547.png",
  "metadata_path": "mystic_teleport_1547.json",
  "generated": {
    "timestamp": "2026-06-06T18:59:05.937531",
    "generator": "MockGenerator-v1",
    "prompt": "神秘的传送阵石碑",
    "seed": 1547,
    "model": "mock"
  },
  "source": {
    "type": "generated",
    "attribution": "AI-generated by asset_general_system"
  }
}