{
  "asset_id": "statue_5013",
  "kind": "tile_object",
  "tags": [
    "statue",
    "monument",
    "decoration",
    "blocking"
  ],
  "tile_size": [
    32,
    32
  ],
  "theme": [
    "temple",
    "ruins",
    "plaza"
  ],
  "footprint": [
    1,
    2
  ],
  "collision": [
    [
      0,
      1
    ]
  ],
  "anchor": "bottom_center",
  "sprite_path": "statue_5013.png",
  "metadata_path": "statue_5013.json",
  "generated": {
    "timestamp": "2026-06-06T16:31:11.629556",
    "generator": "MockGenerator-v1",
    "prompt": "stone statue of a warrior",
    "seed": 5013,
    "model": "mock"
  },
  "source": {
    "type": "generated",
    "attribution": "AI-generated by asset_general_system"
  }
}