{
  "asset_id": "blue_crystal_5077",
  "kind": "tile_object",
  "tags": [
    "blue_crystal",
    "crystal",
    "magic",
    "blue"
  ],
  "tile_size": [
    32,
    32
  ],
  "footprint": [
    1,
    1
  ],
  "anchor": "center",
  "sprite_path": "blue_crystal_5077.png",
  "metadata_path": "blue_crystal_5077.json",
  "generated": {
    "timestamp": "2026-06-06T19:11:55.123243",
    "generator": "gemini/gemini-3.1-flash-image-preview",
    "prompt": "蓝色魔法水晶",
    "seed": 5077,
    "model": "gemini-3.1-flash-image-preview"
  },
  "source": {
    "type": "generated",
    "attribution": "AI-generated by asset_general_system"
  }
}