{
  "asset_id": "gold_chest_3644",
  "kind": "tile_object",
  "tags": [
    "gold_chest",
    "chest",
    "ancient",
    "gold",
    "blocking"
  ],
  "tile_size": [
    32,
    32
  ],
  "footprint": [
    1,
    1
  ],
  "collision": [
    [
      0,
      0
    ]
  ],
  "anchor": "center",
  "sprite_path": "gold_chest_3644.png",
  "metadata_path": "gold_chest_3644.json",
  "generated": {
    "timestamp": "2026-06-06T18:59:05.928519",
    "generator": "MockGenerator-v1",
    "prompt": "古老的金色宝箱",
    "seed": 3644,
    "model": "mock"
  },
  "source": {
    "type": "generated",
    "attribution": "AI-generated by asset_general_system"
  }
}