{
  "asset_id": "tree_palm_5003",
  "kind": "tile_object",
  "tags": [
    "tree_palm",
    "tree",
    "palm",
    "nature",
    "blocking"
  ],
  "tile_size": [
    32,
    32
  ],
  "theme": [
    "desert",
    "beach",
    "tropical"
  ],
  "footprint": [
    1,
    2
  ],
  "collision": [
    [
      0,
      1
    ]
  ],
  "anchor": "bottom_center",
  "sprite_path": "tree_palm_5003.png",
  "metadata_path": "tree_palm_5003.json",
  "generated": {
    "timestamp": "2026-06-06T16:31:11.605865",
    "generator": "MockGenerator-v1",
    "prompt": "palm tree with long leaves and curved trunk",
    "seed": 5003,
    "model": "mock"
  },
  "source": {
    "type": "generated",
    "attribution": "AI-generated by asset_general_system"
  }
}