{
  "asset_id": "ping_pong_table_01_20268979",
  "kind": "tile_object",
  "tags": [
    "ping_pong_table_01",
    "large_prop",
    "ping_pong_table"
  ],
  "tile_size": [
    32,
    32
  ],
  "theme": [
    "school_campus"
  ],
  "footprint": [
    3,
    2
  ],
  "collision": [
    [
      0,
      1
    ],
    [
      1,
      1
    ],
    [
      2,
      1
    ]
  ],
  "anchor": "bottom_center",
  "sprite_path": "ping_pong_table_01_20268979.png",
  "metadata_path": "ping_pong_table_01_20268979.json",
  "generated": {
    "timestamp": "2026-06-09T20:09:12.594501",
    "generator": "MockGenerator-v1",
    "prompt": "1998 年县城小学操场里的水泥乒乓球台，绿色边框已经褪色，台面有细裂纹和灰尘，整体厚重结实，适合 32px tile 网格的 RPG 地图物件。\nStrictly avoid: text, watermark, background, photorealistic",
    "seed": 20268979,
    "model": "mock"
  },
  "source": {
    "type": "generated",
    "attribution": "AI-generated by asset_general_system"
  }
}