{
  "asset_id": "fountain_5015",
  "kind": "tile_object",
  "tags": [
    "fountain",
    "water",
    "decoration",
    "blocking"
  ],
  "tile_size": [
    32,
    32
  ],
  "theme": [
    "plaza",
    "garden",
    "temple"
  ],
  "footprint": [
    2,
    2
  ],
  "collision": [
    [
      0,
      1
    ],
    [
      1,
      1
    ]
  ],
  "anchor": "bottom_center",
  "sprite_path": "fountain_5015.png",
  "metadata_path": "fountain_5015.json",
  "generated": {
    "timestamp": "2026-06-06T16:31:11.633969",
    "generator": "MockGenerator-v1",
    "prompt": "decorative fountain with water",
    "seed": 5015,
    "model": "mock"
  },
  "source": {
    "type": "generated",
    "attribution": "AI-generated by asset_general_system"
  }
}