{
  "asset_id": "magic_mushroom_0253",
  "kind": "tile_object",
  "tags": [
    "magic_mushroom",
    "mushroom",
    "magic",
    "glowing",
    "forest"
  ],
  "tile_size": [
    32,
    32
  ],
  "footprint": [
    1,
    1
  ],
  "anchor": "center",
  "sprite_path": "magic_mushroom_0253.png",
  "metadata_path": "magic_mushroom_0253.json",
  "generated": {
    "timestamp": "2026-06-06T19:12:33.709882",
    "generator": "gemini/gemini-3.1-flash-image-preview",
    "prompt": "魔法森林中的发光蘑菇",
    "seed": 253,
    "model": "gemini-3.1-flash-image-preview"
  },
  "source": {
    "type": "generated",
    "attribution": "AI-generated by asset_general_system"
  }
}