{
  "asset_id": "lamppost_5012",
  "kind": "tile_object",
  "tags": [
    "lamppost",
    "light",
    "decoration",
    "blocking"
  ],
  "tile_size": [
    32,
    32
  ],
  "theme": [
    "village",
    "city",
    "street"
  ],
  "footprint": [
    1,
    2
  ],
  "collision": [
    [
      0,
      1
    ]
  ],
  "anchor": "bottom_center",
  "sprite_path": "lamppost_5012.png",
  "metadata_path": "lamppost_5012.json",
  "generated": {
    "timestamp": "2026-06-06T16:31:11.627027",
    "generator": "MockGenerator-v1",
    "prompt": "iron lamppost with glowing lantern",
    "seed": 5012,
    "model": "mock"
  },
  "source": {
    "type": "generated",
    "attribution": "AI-generated by asset_general_system"
  }
}