{
  "asset_id": "rock_small_5006",
  "kind": "tile_object",
  "tags": [
    "rock_small",
    "rock",
    "stone",
    "nature",
    "blocking"
  ],
  "tile_size": [
    32,
    32
  ],
  "theme": [
    "forest",
    "mountains",
    "desert"
  ],
  "footprint": [
    1,
    1
  ],
  "collision": [
    [
      0,
      0
    ]
  ],
  "anchor": "center",
  "sprite_path": "rock_small_5006.png",
  "metadata_path": "rock_small_5006.json",
  "generated": {
    "timestamp": "2026-06-06T16:31:11.613877",
    "generator": "MockGenerator-v1",
    "prompt": "small gray rock with moss patches",
    "seed": 5006,
    "model": "mock"
  },
  "source": {
    "type": "generated",
    "attribution": "AI-generated by asset_general_system"
  }
}