{
  "asset_id": "tree_willow_5004",
  "kind": "tile_object",
  "tags": [
    "tree_willow",
    "tree",
    "willow",
    "nature",
    "blocking"
  ],
  "tile_size": [
    32,
    32
  ],
  "theme": [
    "village",
    "forest",
    "plains"
  ],
  "footprint": [
    2,
    2
  ],
  "collision": [
    [
      0,
      1
    ],
    [
      1,
      1
    ]
  ],
  "anchor": "bottom_center",
  "sprite_path": "tree_willow_5004.png",
  "metadata_path": "tree_willow_5004.json",
  "generated": {
    "timestamp": "2026-06-06T16:31:11.608945",
    "generator": "MockGenerator-v1",
    "prompt": "willow tree with drooping branches",
    "seed": 5004,
    "model": "mock"
  },
  "source": {
    "type": "generated",
    "attribution": "AI-generated by asset_general_system"
  }
}