{
  "asset_id": "bench_5016",
  "kind": "tile_object",
  "tags": [
    "bench",
    "furniture",
    "decoration"
  ],
  "tile_size": [
    32,
    32
  ],
  "theme": [
    "park",
    "village",
    "plaza"
  ],
  "footprint": [
    2,
    1
  ],
  "anchor": "center",
  "sprite_path": "bench_5016.png",
  "metadata_path": "bench_5016.json",
  "generated": {
    "timestamp": "2026-06-06T16:31:11.635922",
    "generator": "MockGenerator-v1",
    "prompt": "wooden bench with backrest",
    "seed": 5016,
    "model": "mock"
  },
  "source": {
    "type": "generated",
    "attribution": "AI-generated by asset_general_system"
  }
}